{
  "$schema": "https://ihub.pub/schemas/module-descriptor/v1",
  "id": "iam-user",
  "name": "用户管理模块",
  "name_en": "User Management Module",
  "version": "0.1.0",
  "domain": "iam",
  "description": "提供用户账号生命周期管理：注册、认证、档案、状态变更",
  "ai_context": "## 集成模式\n引入 `ihub-module-iam` 依赖即自动配置：`PasswordEncoder`（默认 BCrypt，自定义 Bean 可覆盖）、内存版 `UserService`（自定义 Bean 可替换为持久化实现）、Servlet Web 应用中的 `UserController`（`/api/users`）。\n\n## API 清单\n- `POST /api/users` — 创建用户（201，Location 头；用户名重复 409，参数不合法 400 附字段级错误）\n- `GET /api/users/{id}` — 查询用户详情（404 不存在）\n- `PUT /api/users/{id}` — 更新用户档案（邮箱）\n- `DELETE /api/users/{id}` — 注销用户（软删除，状态置 DELETED）\n- `POST /api/users/{id}/roles` — 追加角色\n- `GET /api/users?keyword=&roleId=&page=&size=` — 分页查询（size 1-100，默认 20；keyword 匹配用户名/邮箱）\n\n## 配置要点\n- `ihub.module.user.default-role`: 新用户默认角色 ID（创建时未指定角色则追加）\n- 密码加密器通过自定义 `PasswordEncoder` Bean 覆盖（默认 BCrypt）\n- 认证校验：`UserService.authenticate(username, rawPassword)`（BCrypt 比对）\n\n## 依赖关系\n- 可选依赖 `iam-role` 模块进行角色分配（不引入 RBAC 亦可独立使用）\n\n## 约束与限制\n- 用户名全局唯一，3-32 位字母/数字/下划线/中划线，注销后不释放\n- 密码 8-72 位（BCrypt 上限），须包含大小写字母和数字；哈希存储，域对象与 API 响应均不含密码\n- 默认存储为内存实现，重启数据丢失，生产环境须以持久化 `UserService` Bean 覆盖\n\n## 常见陷阱\n- 未配置 `default-role` 导致新用户无任何权限\n- 覆盖 `UserService` Bean 时须同时接收 `PasswordEncoder` 参数以保持密码哈希一致\n- 删除为软删除（状态 DELETED），用户名仍占用，不能重建同名用户",
  "capabilities": [
    {
      "id": "user.create",
      "name": "创建用户",
      "type": "api",
      "description": "创建新用户账号，支持设置初始角色",
      "input_schema": {
        "type": "object",
        "required": ["username", "password"],
        "properties": {
          "username": { "type": "string", "minLength": 3, "maxLength": 32 },
          "password": { "type": "string", "minLength": 8 },
          "email": { "type": "string", "format": "email" },
          "roles": { "type": "array", "items": { "type": "string" } }
        }
      },
      "output_schema": {
        "type": "object",
        "properties": {
          "userId": { "type": "string" },
          "username": { "type": "string" },
          "status": { "type": "string", "enum": ["active", "pending"] }
        }
      }
    },
    {
      "id": "user.query",
      "name": "查询用户",
      "type": "api",
      "description": "按条件分页查询用户列表",
      "input_schema": {
        "type": "object",
        "properties": {
          "keyword": { "type": "string" },
          "roleId": { "type": "string" },
          "page": { "type": "integer", "minimum": 0 },
          "size": { "type": "integer", "minimum": 1, "maximum": 100 }
        }
      }
    },
    {
      "id": "user.status-changed",
      "name": "用户状态变更事件",
      "type": "event",
      "description": "用户状态发生变化时发布的领域事件（激活、禁用、注销）",
      "output_schema": {
        "type": "object",
        "properties": {
          "userId": { "type": "string" },
          "oldStatus": { "type": "string" },
          "newStatus": { "type": "string" },
          "timestamp": { "type": "string", "format": "date-time" }
        }
      }
    }
  ],
  "dependencies": [
    {
      "moduleId": "iam-role",
      "required": false,
      "reason": "角色分配功能需要角色模块；若不需要 RBAC 可不引入"
    }
  ],
  "maven": {
    "group": "pub.ihub.module",
    "artifact": "ihub-module-iam"
  },
  "gradle_ref": "ihub-module-iam",
  "config_prefix": "ihub.module.user",
  "tags": ["iam", "user", "authentication", "account"],
  "status": "experimental",
  "mcp_tools": [
    {
      "name": "createUser",
      "description": "创建用户账号。需要提供用户名和密码，可选邮箱和初始角色列表。返回新建用户的 ID 和初始状态",
      "input_schema": {
        "type": "object",
        "required": ["username", "password"],
        "properties": {
          "username": { "type": "string" },
          "password": { "type": "string" },
          "email": { "type": "string" },
          "roles": { "type": "array", "items": { "type": "string" } }
        }
      },
      "output_schema": {
        "type": "object",
        "properties": {
          "userId": { "type": "string" },
          "status": { "type": "string" }
        }
      }
    },
    {
      "name": "queryUsers",
      "description": "按关键字或角色分页查询用户列表。返回符合条件的用户摘要列表",
      "input_schema": {
        "type": "object",
        "properties": {
          "keyword": { "type": "string" },
          "roleId": { "type": "string" },
          "page": { "type": "integer" },
          "size": { "type": "integer" }
        }
      }
    },
    {
      "name": "assignRole",
      "description": "为指定用户分配一个或多个角色。角色立即生效",
      "input_schema": {
        "type": "object",
        "required": ["userId", "roleIds"],
        "properties": {
          "userId": { "type": "string" },
          "roleIds": { "type": "array", "items": { "type": "string" } }
        }
      },
      "output_schema": {
        "type": "object",
        "properties": {
          "success": { "type": "boolean" }
        }
      }
    }
  ]
}
